id,title,genres,keywords,cast,vote_average,vote_count,soup
4347,Atonement,drama romance,based on novel sister sister relationship flirt loss of sister new love,keira knightley james mcavoy romola garai saoirse ronan brenda blethyn,7.4,1049,based on novel sister sister relationship flirt loss of sister new love keira knightley james mcavoy romola garai saoirse ronan brenda blethyn drama romance
37056,Letters to Juliet,comedy drama romance,italy letter romantic comedy american abroad boyfriend girlfriend,amanda seyfried christopher egan gael garcueda bernal vanessa redgrave franco nero,6.6,796,italy letter romantic comedy american abroad boyfriend girlfriend amanda seyfried christopher egan gael garcueda bernal vanessa redgrave franco nero comedy drama romance
4105,Black Rain,action thriller crime,japan yakuza japanese mafia,michael douglas andy garcueda kate capshaw shigeru kufyama john spencer,6.2,243,japan yakuza japanese mafia michael douglas andy garcueda kate capshaw shigeru kufyama john spencer action thriller crime
76489,The Three Stooges,comedy,duringcreditsstinger,sean hayes will sasso chris diamantopoulos jane lynch sofueda vergara,4.9,140,duringcreditsstinger sean hayes will sasso chris diamantopoulos jane lynch sofueda vergara comedy
3933,Corpse Bride,romance fantasy animation music,shyness england cheating old town grave,johnny depp helena bonham carter emily watson tracey ullman paul whitehouse,7.2,1894,shyness england cheating old town grave johnny depp helena bonham carter emily watson tracey ullman paul whitehouse romance fantasy animation music
9918,Glory Road,drama,basketball racial segregation teachers and students,josh lucas derek luke jon voight austin nichols evan jones,7.2,144,basketball racial segregation teachers and students josh lucas derek luke jon voight austin nichols evan jones drama
273481,Sicario,action crime drama mystery thriller,mexico cia smoking texas fbi,emily blunt benicio del toro josh brolin victor garber jon bernthal,7.2,2416,mexico cia smoking texas fbi emily blunt benicio del toro josh brolin victor garber jon bernthal action crime drama mystery thriller
307081,Southpaw,action drama,sport,jake gyllenhaal rachel mcadams forest whitaker oona laurence cent,7.3,2067,sport jake gyllenhaal rachel mcadams forest whitaker oona laurence cent action drama
16871,Drag Me to Hell,horror thriller,gypsy work gore curse psychologist,alison lohman justin long lorna raver dileep rao david paymer,6.2,966,gypsy work gore curse psychologist alison lohman justin long lorna raver dileep rao david paymer horror thriller
293863,The Age of Adaline,fantasy drama romance,san francisco immortality love forever,blake lively michiel huisman harrison ford ellen burstyn kathy baker,7.4,1990,san francisco immortality love forever blake lively michiel huisman harrison ford ellen burstyn kathy baker fantasy drama romance
13156,Secondhand Lions,comedy drama family,texas money veteran,michael caine robert duvall haley joel osment josh lucas kyra sedgwick,6.9,260,texas money veteran michael caine robert duvall haley joel osment josh lucas kyra sedgwick comedy drama family
41233,Step Up 3D,drama romance,musical duringcreditsstinger d,rick malambri adam g sevani joe slaughter sharni vinson alyson stoner,6.6,582,musical duringcreditsstinger d rick malambri adam g sevani joe slaughter sharni vinson alyson stoner drama romance
9266,Blue Crush,adventure,sea surfer hawaii sport job,kate bosworth matthew davis michelle rodriguez sanoe lake mika boorem,5.6,159,sea surfer hawaii sport job kate bosworth matthew davis michelle rodriguez sanoe lake mika boorem adventure
1262,Stranger Than Fiction,comedy drama fantasy romance,professor literature love romantic comedy author,will ferrell maggie gyllenhaal dustin hoffman emma thompson queen latifah,7.1,721,professor literature love romantic comedy author will ferrell maggie gyllenhaal dustin hoffman emma thompson queen latifah comedy drama fantasy romance
4513,30 Days of Night,horror thriller,sunrise winter vampire marriage crisis alaska,josh hartnett melissa george ben foster danny huston mark boone junior,6.2,767,sunrise winter vampire marriage crisis alaska josh hartnett melissa george ben foster danny huston mark boone junior horror thriller
22970,The Cabin in the Woods,horror thriller,cabin plot twist cabin in the woods filmed killing video wall,kristen connolly chris hemsworth anna hutchison fran kranz jesse williams,6.5,2263,cabin plot twist cabin in the woods filmed killing video wall kristen connolly chris hemsworth anna hutchison fran kranz jesse williams horror thriller
7278,Meet the Spartans,comedy,fight queen penguin black hole men,sean maguire carmen electra ken davitian kevin sorbo diedrich bader,3.7,359,fight queen penguin black hole men sean maguire carmen electra ken davitian kevin sorbo diedrich bader comedy
9013,Midnight Run,adventure comedy crime,crooked lawyer bail jumper mafia accountant stretch limousine manhattan new york city,robert de niro charles grodin yaphet kotto john ashton dennis farina,7.2,238,crooked lawyer bail jumper mafia accountant stretch limousine manhattan new york city robert de niro charles grodin yaphet kotto john ashton dennis farina adventure comedy crime
865,The Running Man,action science fiction,prison chase hunting human beings game show dystopia,arnold schwarzenegger richard dawson marueda conchita alonso yaphet kotto jim brown,6.4,703,prison chase hunting human beings game show dystopia arnold schwarzenegger richard dawson marueda conchita alonso yaphet kotto jim brown action science fiction
10776,Little Shop of Horrors,horror comedy music,flower solar eclipse florist assistant plants,rick moranis ellen greene vincent gardenia steve martin tisha campbellmartin,6.6,384,flower solar eclipse florist assistant plants rick moranis ellen greene vincent gardenia steve martin tisha campbellmartin horror comedy music
50456,Hanna,action thriller adventure,assassin self sacrifice strip club secret agent training,saoirse ronan eric bana vicky krieps cate blanchett tom hollander,6.5,1263,assassin self sacrifice strip club secret agent training saoirse ronan eric bana vicky krieps cate blanchett tom hollander action thriller adventure
9823,Mortal Kombat: Annihilation,action fantasy science fiction,martial arts authority tournament battle fighting,robin shou talisa soto james remar sandra hess lynn red williams,3.8,221,martial arts authority tournament battle fighting robin shou talisa soto james remar sandra hess lynn red williams action fantasy science fiction
59861,Larry Crowne,comedy romance drama,classroom college teacher diner loss of job,tom hanks julia roberts bryan cranston cedric the entertainer pam grier,5.7,359,classroom college teacher diner loss of job tom hanks julia roberts bryan cranston cedric the entertainer pam grier comedy romance drama
133805,Carrie,drama horror,terror based on novel power telekinesis high school,chloueb grace moretz julianne moore judy greer alex russell portia doubleday,5.8,1463,terror based on novel power telekinesis high school chloueb grace moretz julianne moore judy greer alex russell portia doubleday drama horror
12763,Take the Lead,music,dancing master dance musical woman director,antonio banderas rob brown yaya dacosta alfre woodard john ortiz,6.6,162,dancing master dance musical woman director antonio banderas rob brown yaya dacosta alfre woodard john ortiz music
9766,Gridiron Gang,action adventure crime drama,competition prisoner probation assistant sport violence,dwayne johnson xzibit l scott caldwell leon rippy kevin dunn,6.5,206,competition prisoner probation assistant sport violence dwayne johnson xzibit l scott caldwell leon rippy kevin dunn action adventure crime drama
12244,9,action adventure animation science fiction thriller,man vs machine hope postapocalyptic dystopia friendship,christopher plummer martin landau john c reilly crispin glover jennifer connelly,6.6,1262,man vs machine hope postapocalyptic dystopia friendship christopher plummer martin landau john c reilly crispin glover jennifer connelly action adventure animation science fiction thriller
109421,Side Effects,thriller crime drama,fraud coverup murder drug prescription medication,jude law rooney mara catherine zetajones channing tatum vinessa shaw,6.4,1323,fraud coverup murder drug prescription medication jude law rooney mara catherine zetajones channing tatum vinessa shaw thriller crime drama
11137,The Prince & Me,comedy romance,secret identity wisconsin prince college modesty,julia stiles luke mably ben miller miranda richardson james fox,5.9,278,secret identity wisconsin prince college modesty julia stiles luke mably ben miller miranda richardson james fox comedy romance
51162,Winnie the Pooh,animation family,owl tiger aftercreditsstinger duringcreditsstinger,jim cummings travis oates bud luckey craig ferguson tom kenny,6.8,258,owl tiger aftercreditsstinger duringcreditsstinger jim cummings travis oates bud luckey craig ferguson tom kenny animation family
10152,Dumb and Dumberer: When Harry Met Lloyd,comedy,skateboarding adoption friendship fate,mimi rogers eric christian olsen luis guzmuen rachel nichols eugene levy,4.1,210,skateboarding adoption friendship fate mimi rogers eric christian olsen luis guzmuen rachel nichols eugene levy comedy
239566,Get on Up,drama music,biography james brown,chadwick boseman nelsan ellis dan aykroyd viola davis lennie james,6.4,158,biography james brown chadwick boseman nelsan ellis dan aykroyd viola davis lennie james drama music
9271,Virtuosity,action crime science fiction thriller,artificial intelligence android hologram computer program virtual reality,denzel washington russell crowe kelly lynch william forsythe stephen spinella,5.4,163,artificial intelligence android hologram computer program virtual reality denzel washington russell crowe kelly lynch william forsythe stephen spinella action crime science fiction thriller
4474,My Super Ex-Girlfriend,fantasy drama action comedy crime,new york flying exboyfriend exgirlfriend disappointment,uma thurman luke wilson anna faris eddie izzard rainn wilson,4.8,442,new york flying exboyfriend exgirlfriend disappointment uma thurman luke wilson anna faris eddie izzard rainn wilson fantasy drama action comedy crime
184346,Deliver Us from Evil,thriller crime horror,possessed demon occult demonic possession,eric bana edgar ramuedrez olivia munn joel mchale sean harris,5.9,690,possessed demon occult demonic possession eric bana edgar ramuedrez olivia munn joel mchale sean harris thriller crime horror
48340,Sanctum,action thriller,cave water adventure,ioan gruffudd richard roxburgh alice parkinson daniel wyllie allison cratchley,5.8,339,cave water adventure ioan gruffudd richard roxburgh alice parkinson daniel wyllie allison cratchley action thriller
14846,Little Black Book,comedy romance drama,plan,brittany murphy holly hunter kathy bates ron livingston kevin sussman,5.2,112,plan brittany murphy holly hunter kathy bates ron livingston kevin sussman comedy romance drama
72207,The Five-Year Engagement,comedy,sex san francisco restaurant frustration chase,jason segel emily blunt chris pratt alison brie rhys ifans,5.7,457,sex san francisco restaurant frustration chase jason segel emily blunt chris pratt alison brie rhys ifans comedy
43539,The Next Three Days,romance drama thriller crime,evidence passport argument county jail fingerprints,russell crowe elizabeth banks brian dennehy rza moran atias,6.9,905,evidence passport argument county jail fingerprints russell crowe elizabeth banks brian dennehy rza moran atias romance drama thriller crime
9920,Ultraviolet,science fiction action thriller,skyscraper vampire victim dystopia boy,milla jovovich cameron bright nick chinlund sebastien andrieu ida martin,4.8,458,skyscraper vampire victim dystopia boy milla jovovich cameron bright nick chinlund sebastien andrieu ida martin science fiction action thriller
8978,Assault on Precinct 13,thriller,drug abuse mexican standoff junkie prison cell snow storm,ethan hawke laurence fishburne gabriel byrne maria bello drea de matteo,6.0,311,drug abuse mexican standoff junkie prison cell snow storm ethan hawke laurence fishburne gabriel byrne maria bello drea de matteo thriller
11702,The Replacement Killers,action drama crime thriller,usa china assault rifle sniper chinatown,chow yunfat mira sorvino michael rooker kenneth tsang jufcrgen prochnow,6.0,127,usa china assault rifle sniper chinatown chow yunfat mira sorvino michael rooker kenneth tsang jufcrgen prochnow action drama crime thriller
8869,Eight Legged Freaks,action comedy horror thriller,pick up wetting pants hockey mask barbershop perfume,david arquette kari wuhrer scott terra scarlett johansson doug e doug,5.4,295,pick up wetting pants hockey mask barbershop perfume david arquette kari wuhrer scott terra scarlett johansson doug e doug action comedy horror thriller
43347,Love & Other Drugs,drama comedy romance,male nudity female nudity letter love viagra,jake gyllenhaal anne hathaway oliver platt hank azaria gabriel macht,6.6,1233,male nudity female nudity letter love viagra jake gyllenhaal anne hathaway oliver platt hank azaria gabriel macht drama comedy romance
3489,88 Minutes,crime mystery thriller,fbi professor ladies man medical examiner serial killer,al pacino alicia witt leelee sobieski amy brenneman william forsythe,5.7,313,fbi professor ladies man medical examiner serial killer al pacino alicia witt leelee sobieski amy brenneman william forsythe crime mystery thriller
9701,North Country,drama,rape secret minnesota witness miner,charlize theron elle peterson thomas curtis frances mcdormand sean bean,6.8,125,rape secret minnesota witness miner charlize theron elle peterson thomas curtis frances mcdormand sean bean drama
2122,The Whole Ten Yards,comedy thriller crime,hitman,bruce willis matthew perry amanda peet kevin pollak frank collison,5.5,278,hitman bruce willis matthew perry amanda peet kevin pollak frank collison comedy thriller crime
37707,Splice,horror thriller science fiction,dna genetics gene manipulation genetic engineering biological experiment,adrien brody sarah polley delphine chanueac david hewlett abigail chu,5.5,671,dna genetics gene manipulation genetic engineering biological experiment adrien brody sarah polley delphine chanueac david hewlett abigail chu horror thriller science fiction
10658,Howard the Duck,comedy fantasy science fiction,duck physicist extraterrestrial anthropomorphism alien invasion,lea thompson jeffrey jones tim robbins ed gale holly robinson peete,5.1,221,duck physicist extraterrestrial anthropomorphism alien invasion lea thompson jeffrey jones tim robbins ed gale holly robinson peete comedy fantasy science fiction
13150,Pride and Glory,thriller crime drama,megacity brotherinlaw police,edward norton jon voight colin farrell noah emmerich jennifer ehle,6.3,240,megacity brotherinlaw police edward norton jon voight colin farrell noah emmerich jennifer ehle thriller crime drama
9042,The Cave,action adventure horror thriller,fall burned alive violence diver swimwear,cole hauser eddie cibrian morris chestnut lena headey piper perabo,5.1,202,fall burned alive violence diver swimwear cole hauser eddie cibrian morris chestnut lena headey piper perabo action adventure horror thriller
11208,Wicker Park,drama mystery romance thriller,love of ones life leave lookalike intrigue,josh hartnett rose byrne matthew lillard diane kruger christopher cousins,6.7,157,love of ones life leave lookalike intrigue josh hartnett rose byrne matthew lillard diane kruger christopher cousins drama mystery romance thriller
58151,Fright Night,horror comedy,sunrise vampire suspicion remake suburbia,anton yelchin colin farrell toni collette christopher mintzplasse david tennant,6.0,603,sunrise vampire suspicion remake suburbia anton yelchin colin farrell toni collette christopher mintzplasse david tennant horror comedy
11400,The New World,drama history romance,chief colonialism new world,colin farrell qorianka kilcher christopher plummer christian bale august schellenberg,6.4,330,chief colonialism new world colin farrell qorianka kilcher christopher plummer christian bale august schellenberg drama history romance
14164,Dragonball Evolution,action adventure fantasy science fiction thriller,karate superhero revenge dragon duringcreditsstinger,chow yunfat justin chatwin joon park jamie chung emmy rossum,2.9,462,karate superhero revenge dragon duringcreditsstinger chow yunfat justin chatwin joon park jamie chung emmy rossum action adventure fantasy science fiction thriller
76640,The Last Stand,action crime thriller,sheriff small town hostage prisoner fbi,arnold schwarzenegger forest whitaker rodrigo santoro johnny knoxville jaimie alexander,5.7,1266,sheriff small town hostage prisoner fbi arnold schwarzenegger forest whitaker rodrigo santoro johnny knoxville jaimie alexander action crime thriller
11058,Godsend,drama horror science fiction thriller,schizophrenia clone loss of son nightmare doctor,greg kinnear rebecca romijn robert de niro cameron bright zoie palmer,4.7,114,schizophrenia clone loss of son nightmare doctor greg kinnear rebecca romijn robert de niro cameron bright zoie palmer drama horror science fiction thriller
14844,Chasing Liberty,comedy romance,venice berlin usa president undercover prague,mandy moore stark sands tony jayawardena jeremy piven annabella sciorra,6.1,152,venice berlin usa president undercover prague mandy moore stark sands tony jayawardena jeremy piven annabella sciorra comedy romance
57089,Hoodwinked Too! Hood VS. Evil,comedy animation family,witch wolf little red riding hood sequel computer animation,hayden panettiere bill hader joan cusack patrick warburton glenn close,4.8,131,witch wolf little red riding hood sequel computer animation hayden panettiere bill hader joan cusack patrick warburton glenn close comedy animation family
1947,An Unfinished Life,drama,loss of son sheriff wyoming grandfather granddaughter relationship violence against women,robert redford jennifer lopez morgan freeman becca gardner josh lucas,6.7,161,loss of son sheriff wyoming grandfather granddaughter relationship violence against women robert redford jennifer lopez morgan freeman becca gardner josh lucas drama
8054,The Imaginarium of Doctor Parnassus,adventure fantasy mystery,circus immortality elderly aftercreditsstinger duringcreditsstinger,christopher plummer heath ledger johnny depp jude law colin farrell,6.3,869,circus immortality elderly aftercreditsstinger duringcreditsstinger christopher plummer heath ledger johnny depp jude law colin farrell adventure fantasy mystery
46829,Barney's Version,comedy drama,suicide jealousy canada independent film politically incorrect,paul giamatti dustin hoffman rosamund pike minnie driver rachelle lefevre,7.2,129,suicide jealousy canada independent film politically incorrect paul giamatti dustin hoffman rosamund pike minnie driver rachelle lefevre comedy drama
146238,Runner Runner,crime thriller drama,gambling casino gambling debts dirty cop puerto rico,ben affleck gemma arterton justin timberlake anthony mackie david costabile,5.5,543,gambling casino gambling debts dirty cop puerto rico ben affleck gemma arterton justin timberlake anthony mackie david costabile crime thriller drama
9989,Antitrust,action crime drama,technology garage hacker male friendship microchip,ryan phillippe rachael leigh cook tim robbins claire forlani richard roundtree,5.8,153,technology garage hacker male friendship microchip ryan phillippe rachael leigh cook tim robbins claire forlani richard roundtree action crime drama
9665,Glory,war,war racism battle union soldier confederate soldier,matthew broderick denzel washington cary elwes morgan freeman jihmi kennedy,7.4,383,war racism battle union soldier confederate soldier matthew broderick denzel washington cary elwes morgan freeman jihmi kennedy war
311,Once Upon a Time in America,drama crime,life and death corruption street gang rape sadistic,robert de niro james woods elizabeth mcgovern joe pesci burt young,8.2,1069,life and death corruption street gang rape sadistic robert de niro james woods elizabeth mcgovern joe pesci burt young drama crime
102362,Dead Man Down,thriller action crime drama,revenge new york city mysterious woman crime lord,colin farrell noomi rapace terrence howard dominic cooper isabelle huppert,5.9,638,revenge new york city mysterious woman crime lord colin farrell noomi rapace terrence howard dominic cooper isabelle huppert thriller action crime drama
11162,The Merchant of Venice,drama romance,venice shakespeare jew ship salesperson,al pacino jeremy irons joseph fiennes lynn collins zuleikha robinson,6.7,144,venice shakespeare jew ship salesperson al pacino jeremy irons joseph fiennes lynn collins zuleikha robinson drama romance
13967,Miss Potter,drama family romance,loss of lover mountain lake author rabbit,ewan mcgregor renuee zellweger emily watson barbara flynn bill paterson,6.3,141,loss of lover mountain lake author rabbit ewan mcgregor renuee zellweger emily watson barbara flynn bill paterson drama family romance
9053,DOA: Dead or Alive,adventure action thriller,competition martial arts kung fu assassin fight,jaime pressly devon aoki holly valance sarah carter natassia malthe,5.0,205,competition martial arts kung fu assassin fight jaime pressly devon aoki holly valance sarah carter natassia malthe adventure action thriller
4512,The Assassination of Jesse James by the Coward Robert Ford,action drama western,killing admiration holdup robbery to shoot dead idol,brad pitt casey affleck sam shepard marylouise parker paul schneider,7.0,776,killing admiration holdup robbery to shoot dead idol brad pitt casey affleck sam shepard marylouise parker paul schneider action drama western
31203,Little Nicholas,comedy,,maxime godart valuerie lemercier kad merad sandrine kiberlain franueoisxavier demaison,5.9,306, maxime godart valuerie lemercier kad merad sandrine kiberlain franueoisxavier demaison comedy
265208,Wild Card,thriller crime drama,gambling bodyguard remake,jason statham michael angarano milo ventimiglia dominik garcuedalorido anne heche,5.4,656,gambling bodyguard remake jason statham michael angarano milo ventimiglia dominik garcuedalorido anne heche thriller crime drama
45610,Machine Gun Preacher,action thriller crime,underage soldier duringcreditsstinger,gerard butler michelle monaghan kathy baker richard goteri peter carey,6.4,286,underage soldier duringcreditsstinger gerard butler michelle monaghan kathy baker richard goteri peter carey action thriller crime
215211,Grace of Monaco,romance drama,monaco prince,nicole kidman milo ventimiglia paz vega tim roth parker posey,5.8,195,monaco prince nicole kidman milo ventimiglia paz vega tim roth parker posey romance drama
223702,Sausage Party,adventure animation comedy fantasy,supermarket party sausage food anthropomorphism,seth rogen kristen wiig jonah hill bill hader michael cera,5.6,2238,supermarket party sausage food anthropomorphism seth rogen kristen wiig jonah hill bill hader michael cera adventure animation comedy fantasy
254470,Pitch Perfect 2,comedy music,music sequel singer male female relationship audition,anna kendrick rebel wilson hailee steinfeld brittany snow skylar astin,6.8,1940,music sequel singer male female relationship audition anna kendrick rebel wilson hailee steinfeld brittany snow skylar astin comedy music
69,Walk the Line,drama music romance,germany prison music record adultery country music,joaquin phoenix reese witherspoon ginnifer goodwin robert patrick tyler hilton,7.3,718,germany prison music record adultery country music joaquin phoenix reese witherspoon ginnifer goodwin robert patrick tyler hilton drama music romance
4967,Keeping the Faith,comedy,love triangle rabbi priest catholicism,ben stiller edward norton jenna elfman anne bancroft eli wallach,5.9,159,love triangle rabbi priest catholicism ben stiller edward norton jenna elfman anne bancroft eli wallach comedy
9449,The Borrowers,adventure fantasy action comedy family,dwarves household lawyer little people childs point of view,john goodman jim broadbent celia imrie tom felton hugh laurie,5.8,135,dwarves household lawyer little people childs point of view john goodman jim broadbent celia imrie tom felton hugh laurie adventure fantasy action comedy family
11499,Frost/Nixon,drama history,camera lie scandal watergate scandal richard nixon,michael sheen frank langella kevin bacon sam rockwell mark simich,7.2,328,camera lie scandal watergate scandal richard nixon michael sheen frank langella kevin bacon sam rockwell mark simich drama history
4912,Confessions of a Dangerous Mind,comedy crime drama romance thriller,microfilm biography silencer intrigue,sam rockwell drew barrymore julia roberts rutger hauer brad pitt,6.6,275,microfilm biography silencer intrigue sam rockwell drew barrymore julia roberts rutger hauer brad pitt comedy crime drama romance thriller
323676,The Boss,comedy,business woman excon duringcreditsstinger girl scouts,melissa mccarthy peter dinklage kristen bell kathy bates kristen schaal,5.5,431,business woman excon duringcreditsstinger girl scouts melissa mccarthy peter dinklage kristen bell kathy bates kristen schaal comedy
11249,Seed of Chucky,drama horror comedy,baby puppet filmdreh murder killer doll,brad dourif jennifer tilly billy boyd redman hannah spearritt,4.9,287,baby puppet filmdreh murder killer doll brad dourif jennifer tilly billy boyd redman hannah spearritt drama horror comedy
9667,The Jacket,drama mystery thriller fantasy,smoking medicine psychology hallucination human experimentation,adrien brody keira knightley kris kristofferson jennifer jason leigh kelly lynch,6.8,455,smoking medicine psychology hallucination human experimentation adrien brody keira knightley kris kristofferson jennifer jason leigh kelly lynch drama mystery thriller fantasy
