id,title,genres,keywords,cast,vote_average,vote_count,soup
11186,Child's Play 2,drama horror,faithlessness puppet killer toys toy comes to life,alex vincent jenny agutter gerrit graham christine elise brad dourif,5.8,308,faithlessness puppet killer toys toy comes to life alex vincent jenny agutter gerrit graham christine elise brad dourif drama horror
136835,No Good Deed,crime thriller,sadistic hostage sociopath serial killer blood,idris elba taraji p henson leslie bibb kate del castillo henry simmons,5.6,181,sadistic hostage sociopath serial killer blood idris elba taraji p henson leslie bibb kate del castillo henry simmons crime thriller
5876,The Mist,science fiction horror thriller,father son relationship monster supermarket fight artist,thomas jane marcia gay harden laurie holden andre braugher toby jones,6.7,1399,father son relationship monster supermarket fight artist thomas jane marcia gay harden laurie holden andre braugher toby jones science fiction horror thriller
264660,Ex Machina,drama science fiction,dancing artificial intelligence distrust isolation technology,domhnall gleeson alicia vikander oscar isaac sonoya mizuno corey johnson,7.6,4737,dancing artificial intelligence distrust isolation technology domhnall gleeson alicia vikander oscar isaac sonoya mizuno corey johnson drama science fiction
492,Being John Malkovich,fantasy drama comedy,individual transvestism sexual identity witch identity,john cusack cameron diaz catherine keener charlie sheen john malkovich,7.3,1101,individual transvestism sexual identity witch identity john cusack cameron diaz catherine keener charlie sheen john malkovich fantasy drama comedy
238603,Earth to Echo,family adventure science fiction,alien found footage,teo halm astro resse hartwig ella wahlestedt jason graystanford,5.7,290,alien found footage teo halm astro resse hartwig ella wahlestedt jason graystanford family adventure science fiction
1251,Letters from Iwo Jima,action adventure drama war,world war ii cave dying and death pacific theater japanese army,ken watanabe kazunari ninomiya tsuyoshi ihara ryo kase shidou nakamura,7.2,541,world war ii cave dying and death pacific theater japanese army ken watanabe kazunari ninomiya tsuyoshi ihara ryo kase shidou nakamura action adventure drama war
5172,The Astronaut Farmer,adventure comedy drama science fiction,nasa texas dream fbi bankrupt,billy bob thornton virginia madsen max thieriot jasper polish logan polish,6.2,123,nasa texas dream fbi bankrupt billy bob thornton virginia madsen max thieriot jasper polish logan polish adventure comedy drama science fiction
264644,Room,drama thriller,based on novel carpet isolation kidnapping imprisonment,brie larson jacob tremblay joan allen sean bridgers william h macy,8.1,2757,based on novel carpet isolation kidnapping imprisonment brie larson jacob tremblay joan allen sean bridgers william h macy drama thriller
11592,Serial Mom,comedy crime horror thriller,housewife protection motherly love evil mother murder,kathleen turner sam waterston ricki lake matthew lillard traci lords,6.4,135,housewife protection motherly love evil mother murder kathleen turner sam waterston ricki lake matthew lillard traci lords comedy crime horror thriller
3682,54,music drama,new york sex nightclub money drug,ryan phillippe salma hayek breckin meyer mike myers neve campbell,5.5,135,new york sex nightclub money drug ryan phillippe salma hayek breckin meyer mike myers neve campbell music drama
9683,Bubble Boy,adventure comedy drama romance,lovesickness niagara falls crush youth illness,jake gyllenhaal swoosie kurtz marley shelton danny trejo john carroll lynch,5.1,163,lovesickness niagara falls crush youth illness jake gyllenhaal swoosie kurtz marley shelton danny trejo john carroll lynch adventure comedy drama romance
107811,21 & Over,comedy,alcohol birthday debauchery,miles teller skylar astin justin chon sarah wright jonathan keltz,5.7,737,alcohol birthday debauchery miles teller skylar astin justin chon sarah wright jonathan keltz comedy
2266,"Paris, je t'aime",drama romance,paris city portrait jazz subway new love,steve buscemi natalie portman willem dafoe maggie gyllenhaal axel kiener,6.8,207,paris city portrait jazz subway new love steve buscemi natalie portman willem dafoe maggie gyllenhaal axel kiener drama romance
144340,Admission,comedy drama romance,princeton university admissions,tina fey paul rudd michael sheen lily tomlin wallace shawn,5.4,304,princeton university admissions tina fey paul rudd michael sheen lily tomlin wallace shawn comedy drama romance
28211,Chloe,drama thriller mystery,toronto lesbian remake of french film suspicious wife female doctor,julianne moore liam neeson amanda seyfried max thieriot r h thomson,5.9,498,toronto lesbian remake of french film suspicious wife female doctor julianne moore liam neeson amanda seyfried max thieriot r h thomson drama thriller mystery
9950,Find Me Guilty,drama action comedy crime,court case staatsanwueltin family clan gangster,vin diesel alex rocco frank pietrangolare richard dedomenico paul borghese,6.5,138,court case staatsanwueltin family clan gangster vin diesel alex rocco frank pietrangolare richard dedomenico paul borghese drama action comedy crime
84892,The Perks of Being a Wallflower,drama romance,shyness secret narration kiss freshman,logan lerman emma watson ezra miller paul rudd nina dobrev,7.7,2968,shyness secret narration kiss freshman logan lerman emma watson ezra miller paul rudd nina dobrev drama romance
157544,The Vatican Tapes,thriller horror,exorcism antichrist exorcist,olivia taylor dudley michael peufa djimon hounsou dougray scott peter andersson,4.6,243,exorcism antichrist exorcist olivia taylor dudley michael peufa djimon hounsou dougray scott peter andersson thriller horror
59678,Attack the Block,action comedy science fiction,street gang fireworks chase meteor playground,nick frost jodie whittaker john boyega luke treadaway flaminia cinque,6.3,733,street gang fireworks chase meteor playground nick frost jodie whittaker john boyega luke treadaway flaminia cinque action comedy science fiction
158011,The Call,crime thriller,underground gas station kidnapping murder suspense,halle berry abigail breslin morris chestnut michael imperioli ella rae peck,6.6,1257,underground gas station kidnapping murder suspense halle berry abigail breslin morris chestnut michael imperioli ella rae peck crime thriller
8952,I Love You Phillip Morris,comedy drama romance,judge small town con man fraud jail,jim carrey ewan mcgregor leslie mann rodrigo santoro brennan brown,6.4,503,judge small town con man fraud jail jim carrey ewan mcgregor leslie mann rodrigo santoro brennan brown comedy drama romance
62204,Quest for Fire,adventure drama,stone age cavemen prehistoric adventure prehistoric times prehistoric man,everett mcgill ron perlman nicholas kadi rae dawn chong gary schwartz,7.1,109,stone age cavemen prehistoric adventure prehistoric times prehistoric man everett mcgill ron perlman nicholas kadi rae dawn chong gary schwartz adventure drama
13435,Antwone Fisher,drama romance,us navy biography,derek luke malcolm david kelley cory hodges denzel washington joy bryant,6.7,137,us navy biography derek luke malcolm david kelley cory hodges denzel washington joy bryant drama romance
319,True Romance,action thriller crime romance,father son relationship film producer mexican standoff loss of father cocaine,christian slater patricia arquette michael rapaport bronson pinchot gary oldman,7.5,749,father son relationship film producer mexican standoff loss of father cocaine christian slater patricia arquette michael rapaport bronson pinchot gary oldman action thriller crime romance
9504,Glengarry Glen Ross,crime drama mystery,robbery office shop estate agent company,al pacino jack lemmon alec baldwin alan arkin ed harris,7.5,323,robbery office shop estate agent company al pacino jack lemmon alec baldwin alan arkin ed harris crime drama mystery
37414,The Killer Inside Me,crime drama thriller,sheriff crime fighter,casey affleck kate hudson jessica alba ned beatty tom bower,6.0,173,sheriff crime fighter casey affleck kate hudson jessica alba ned beatty tom bower crime drama thriller
26688,Sorority Row,horror mystery thriller,female nudity graduation serial killer blood slasher,rumer willis briana evigan jamie chung leah pipes teri andrzejewski,5.4,177,female nudity graduation serial killer blood slasher rumer willis briana evigan jamie chung leah pipes teri andrzejewski horror mystery thriller
6615,Lars and the Real Girl,comedy romance drama,garage lone wolf dying and death loss delusion,ryan gosling emily mortimer paul schneider kelli garner lauren ash,7.1,509,garage lone wolf dying and death loss delusion ryan gosling emily mortimer paul schneider kelli garner lauren ash comedy romance drama
14574,The Boy in the Striped Pyjamas,war drama,nationalism concentration camp world war ii gas chamber nazis,asa butterfield jack scanlon vera farmiga david thewlis rupert friend,7.7,1451,nationalism concentration camp world war ii gas chamber nazis asa butterfield jack scanlon vera farmiga david thewlis rupert friend war drama
16,Dancer in the Dark,drama crime music,individual dancing usa robbery factory worker,bjufrk catherine deneuve david morse peter stormare joel grey,7.6,377,individual dancing usa robbery factory worker bjufrk catherine deneuve david morse peter stormare joel grey drama crime music
23631,Machete,action comedy thriller,illegal immigration immigration law machete politician death of a child,danny trejo michelle rodriguez jessica alba robert de niro lindsay lohan,6.3,1150,illegal immigration immigration law machete politician death of a child danny trejo michelle rodriguez jessica alba robert de niro lindsay lohan action comedy thriller
12144,The Land Before Time,animation adventure family,vulkan loss of mother tyrannosaurus rex earthquake primitive time,gabriel damon candace hutson judith barsi will ryan pat hingle,7.0,640,vulkan loss of mother tyrannosaurus rex earthquake primitive time gabriel damon candace hutson judith barsi will ryan pat hingle animation adventure family
11658,Tae Guk Gi: The Brotherhood of War,action adventure drama history war,archaeologist korean war north korea south korea air raid,jang donggun won bin lee eunju gong hyungjin park jeongwoo,7.4,133,archaeologist korean war north korea south korea air raid jang donggun won bin lee eunju gong hyungjin park jeongwoo action adventure drama history war
9552,The Exorcist,drama horror thriller,exorcism holy water religion and supernatural vomit christian,linda blair max von sydow ellen burstyn jason miller lee j cobb,7.5,2005,exorcism holy water religion and supernatural vomit christian linda blair max von sydow ellen burstyn jason miller lee j cobb drama horror thriller
578,Jaws,horror thriller adventure,fishing atlantic ocean bathing shipwreck police chief,roy scheider robert shaw richard dreyfuss lorraine gary murray hamilton,7.5,2542,fishing atlantic ocean bathing shipwreck police chief roy scheider robert shaw richard dreyfuss lorraine gary murray hamilton horror thriller adventure
2105,American Pie,comedy romance,graduation innocence coming of age teenager high school student,jason biggs chris klein thomas ian nicholas alyson hannigan shannon elizabeth,6.4,2296,graduation innocence coming of age teenager high school student jason biggs chris klein thomas ian nicholas alyson hannigan shannon elizabeth comedy romance
126319,Ernest & Celestine,animation comedy drama family,mouse musician friendship prejudice bear,annemarie loop lambert wilson pauline brunner patrice melennec brigitte virtudes,7.6,142,mouse musician friendship prejudice bear annemarie loop lambert wilson pauline brunner patrice melennec brigitte virtudes animation comedy drama family
10136,The Golden Child,action adventure comedy,monk social worker wretch tibet demon,eddie murphy charles dance charlotte lewis victor wong peter kwong,5.6,304,monk social worker wretch tibet demon eddie murphy charles dance charlotte lewis victor wong peter kwong action adventure comedy
67660,Think Like a Man,comedy romance,advice love relationship ensemble cast duringcreditsstinger,michael ealy jerry ferrara meagan good regina hall kevin hart,6.9,281,advice love relationship ensemble cast duringcreditsstinger michael ealy jerry ferrara meagan good regina hall kevin hart comedy romance
10611,Barbershop,comedy drama,hairdresser shop neighbor debt meeting,ice cube anthony anderson cedric the entertainer sean patrick thomas eve,6.2,137,hairdresser shop neighbor debt meeting ice cube anthony anderson cedric the entertainer sean patrick thomas eve comedy drama
154,Star Trek II: The Wrath of Khan,action adventure science fiction thriller,uss enterprise genesis asteroid self sacrifice midlife crisis,william shatner leonard nimoy deforest kelley james doohan george takei,7.3,675,uss enterprise genesis asteroid self sacrifice midlife crisis william shatner leonard nimoy deforest kelley james doohan george takei action adventure science fiction thriller
3049,Ace Ventura: Pet Detective,comedy mystery,dolphin mascot private detective pets,jim carrey sean young courteney cox tone loc dan marino,6.4,1648,dolphin mascot private detective pets jim carrey sean young courteney cox tone loc dan marino comedy mystery
860,WarGames,thriller science fiction,video game artificial intelligence fbi cold war hacker,matthew broderick dabney coleman ally sheedy john wood barry corbin,7.0,504,video game artificial intelligence fbi cold war hacker matthew broderick dabney coleman ally sheedy john wood barry corbin thriller science fiction
9281,Witness,crime drama romance thriller,corruption detective police brutality amish suspense,harrison ford kelly mcgillis josef sommer lukas haas jan rubes,7.0,375,corruption detective police brutality amish suspense harrison ford kelly mcgillis josef sommer lukas haas jan rubes crime drama romance thriller
75674,Act of Valor,action thriller war,submarine navy scuba diving heroism navy seal,roselyn suenchez emilio rivera nestor serrano gonzalo menendez alexander asefa,6.3,417,submarine navy scuba diving heroism navy seal roselyn suenchez emilio rivera nestor serrano gonzalo menendez alexander asefa action thriller war
9762,Step Up,music drama romance crime,dancing new love dance baltimore art school,channing tatum jenna dewan damaine radcliff deshawn washington mario,6.7,1060,dancing new love dance baltimore art school channing tatum jenna dewan damaine radcliff deshawn washington mario music drama romance crime
3179,Beavis and Butt-Head Do America,animation comedy,washington dc casino hotel sun television,mike judge bruce willis demi moore robert stack richard linklater,6.5,168,washington dc casino hotel sun television mike judge bruce willis demi moore robert stack richard linklater animation comedy
184,Jackie Brown,comedy crime romance,airport underworld arms deal weapon police,pam grier samuel l jackson robert forster bridget fonda michael keaton,7.3,1514,airport underworld arms deal weapon police pam grier samuel l jackson robert forster bridget fonda michael keaton comedy crime romance
13335,Harold & Kumar Escape from Guantanamo Bay,comedy adventure,terrorist aftercreditsstinger duringcreditsstinger,john cho kal penn neil patrick harris rob corddry jack conley,6.2,497,terrorist aftercreditsstinger duringcreditsstinger john cho kal penn neil patrick harris rob corddry jack conley comedy adventure
76726,Chronicle,science fiction drama thriller,seattle telekinesis friendship loneliness outcast,dane dehaan alex russell michael b jordan michael kelly anna wood,6.6,1935,seattle telekinesis friendship loneliness outcast dane dehaan alex russell michael b jordan michael kelly anna wood science fiction drama thriller
36819,Time Bandits,family fantasy science fiction adventure comedy,treasure map magic time travel titanic,sean connery john cleese shelley duvall michael palin ian holm,6.6,249,treasure map magic time travel titanic sean connery john cleese shelley duvall michael palin ian holm family fantasy science fiction adventure comedy
17130,Crossroads,action adventure comedy drama family,dancing women sex karaoke dream,britney spears zoe saldana taryn manning anson mount dan aykroyd,4.7,158,dancing women sex karaoke dream britney spears zoe saldana taryn manning anson mount dan aykroyd action adventure comedy drama family
57214,Project X,comedy crime,vandalism high school swimming pool party teen movie,oliver cooper jonathan daniel brown thomas mann dax flame kirby bliss blanton,6.5,1564,vandalism high school swimming pool party teen movie oliver cooper jonathan daniel brown thomas mann dax flame kirby bliss blanton comedy crime
11202,Patton,drama history war,general world war ii normandy biography historical figure,george c scott karl malden stephen young michael strong carey loftin,7.3,323,general world war ii normandy biography historical figure george c scott karl malden stephen young michael strong carey loftin drama history war
9357,One Hour Photo,horror thriller,sexual abuse hotel room cheating supermarket penalty,robin williams connie nielsen michael vartan erin daniels eriq la salle,6.6,435,sexual abuse hotel room cheating supermarket penalty robin williams connie nielsen michael vartan erin daniels eriq la salle horror thriller
13812,Quarantine,horror science fiction thriller,quarantine remake tv reporter found footage virus,jennifer carpenter steve harris jay hernandez johnathon schaech columbus short,5.5,339,quarantine remake tv reporter found footage virus jennifer carpenter steve harris jay hernandez johnathon schaech columbus short horror science fiction thriller
9030,The Eye,drama horror thriller,sister sister relationship blindness and impaired vision eye operation eyesight dying and death,jessica alba alessandro nivola parker posey rade serbedzija fernanda romero,5.5,281,sister sister relationship blindness and impaired vision eye operation eyesight dying and death jessica alba alessandro nivola parker posey rade serbedzija fernanda romero drama horror thriller
8386,How High,comedy,carpet pimp harvard university joint cannabis,method man redman obba babatundue mike epps anna maria horsford,6.3,218,carpet pimp harvard university joint cannabis method man redman obba babatundue mike epps anna maria horsford comedy
10437,The Muppet Christmas Carol,comedy family fantasy drama,holiday future musical past scrooge,michael caine don austen meredith braun don austen ed sanders,7.2,212,holiday future musical past scrooge michael caine don austen meredith braun don austen ed sanders comedy family fantasy drama
1360,Frida,drama romance,painter love of ones life disabled woman director,salma hayek alfred molina mueda maestro patricia reyes spuedndola diego luna,7.3,383,painter love of ones life disabled woman director salma hayek alfred molina mueda maestro patricia reyes spuedndola diego luna drama romance
222935,The Fault in Our Stars,romance drama,amsterdam based on novel support group cancer teenager,shailene woodley ansel elgort nat wolff laura dern sam trammell,7.6,3759,amsterdam based on novel support group cancer teenager shailene woodley ansel elgort nat wolff laura dern sam trammell romance drama
10220,Rounders,drama crime,gambling law compulsive gambling roulette gain,matt damon john turturro gretchen mol goran visnjic edward norton,6.9,439,gambling law compulsive gambling roulette gain matt damon john turturro gretchen mol goran visnjic edward norton drama crime
284296,Top Five,drama comedy,comedian interview reporter movie star fiancue fiancuee relationship,chris rock rosario dawson jb smoove gabrielle union romany malco,6.3,210,comedian interview reporter movie star fiancue fiancuee relationship chris rock rosario dawson jb smoove gabrielle union romany malco drama comedy
11601,Stir of Echoes,horror mystery thriller,secret obsession paranoia grave haunted house,kevin bacon kathryn erbe illeana douglas kevin dunn conor ofarrell,6.5,330,secret obsession paranoia grave haunted house kevin bacon kathryn erbe illeana douglas kevin dunn conor ofarrell horror mystery thriller
205220,Philomena,drama,mother washington dc journalist adoption forgiveness,judi dench steve coogan sophie kennedy clark mare winningham barbara jefford,7.4,579,mother washington dc journalist adoption forgiveness judi dench steve coogan sophie kennedy clark mare winningham barbara jefford drama
14191,Aquamarine,fantasy romance family comedy,female friendship mermaid teenager woman director,emma roberts joanna jojo levesque sara paxton jake mcdorman arielle kebbel,5.8,364,female friendship mermaid teenager woman director emma roberts joanna jojo levesque sara paxton jake mcdorman arielle kebbel fantasy romance family comedy
286565,Paper Towns,drama mystery romance,friendship high school teenager classmate based on young adult novel,nat wolff cara delevingne justice smith austin abrams halston sage,6.1,1937,friendship high school teenager classmate based on young adult novel nat wolff cara delevingne justice smith austin abrams halston sage drama mystery romance
129670,Nebraska,drama adventure,montana small town dementia aging road trip,bruce dern will forte bob odenkirk june squibb stacy keach,7.4,636,montana small town dementia aging road trip bruce dern will forte bob odenkirk june squibb stacy keach drama adventure
57157,Young Adult,comedy drama,jealousy dark comedy writer divorce alcoholic,charlize theron patton oswalt patrick wilson elizabeth reaser collette wolfe,5.6,364,jealousy dark comedy writer divorce alcoholic charlize theron patton oswalt patrick wilson elizabeth reaser collette wolfe comedy drama
1948,Crank,action thriller crime,poison helicopter assassin nudity hitman,jason statham amy smart jose pablo cantillo efren ramirez dwight yoakam,6.6,1151,poison helicopter assassin nudity hitman jason statham amy smart jose pablo cantillo efren ramirez dwight yoakam action thriller crime
14976,Rachel Getting Married,drama,sister independent film maid of honor,anne hathaway rosemarie dewitt sebastian stan roslyn ruff bill irwin,6.1,163,sister independent film maid of honor anne hathaway rosemarie dewitt sebastian stan roslyn ruff bill irwin drama
11027,The Postman Always Rings Twice,romance crime drama,sex adultery confession based on novel obsession,jack nicholson jessica lange john colicos michael lerner anjelica huston,6.4,110,sex adultery confession based on novel obsession jack nicholson jessica lange john colicos michael lerner anjelica huston romance crime drama
3635,Girl with a Pearl Earring,drama romance,painter biography painting maid,scarlett johansson colin firth cillian murphy tom wilkinson judy parfitt,6.4,377,painter biography painting maid scarlett johansson colin firth cillian murphy tom wilkinson judy parfitt drama romance
387,Das Boot,action drama history war adventure,terror submarine based on novel atlantic ocean gibraltar,jufcrgen prochnow herbert grufnemeyer klaus wennemann hubertus bengsch martin semmelrogge,7.9,613,terror submarine based on novel atlantic ocean gibraltar jufcrgen prochnow herbert grufnemeyer klaus wennemann hubertus bengsch martin semmelrogge action drama history war adventure
122906,About Time,comedy drama science fiction,london england father son relationship time travel,domhnall gleeson rachel mcadams bill nighy lydia wilson lindsay duncan,7.8,2067,london england father son relationship time travel domhnall gleeson rachel mcadams bill nighy lydia wilson lindsay duncan comedy drama science fiction
9550,House of Flying Daggers,adventure drama action romance,martial arts swordplay government rebellion dagger,takeshi kaneshiro andy lau zhang ziyi song dandan zhao hongfei,7.1,439,martial arts swordplay government rebellion dagger takeshi kaneshiro andy lau zhang ziyi song dandan zhao hongfei adventure drama action romance
60599,Arbitrage,drama thriller,coverup hedge fund,richard gere susan sarandon tim roth brit marling monica raymund,6.1,294,coverup hedge fund richard gere susan sarandon tim roth brit marling monica raymund drama thriller
227719,Project Almanac,science fiction thriller,time travel time machine teenager found footage,jonny weston virginia gardner sofia blackdelia sam lerner allen evangelista,6.4,933,time travel time machine teenager found footage jonny weston virginia gardner sofia blackdelia sam lerner allen evangelista science fiction thriller
12088,Fortress,action thriller science fiction,prison cyborg married couple future dystopia,christopher lambert kurtwood smith loryn locklin clifton collins jr jeffrey combs,5.7,168,prison cyborg married couple future dystopia christopher lambert kurtwood smith loryn locklin clifton collins jr jeffrey combs action thriller science fiction
9466,Celebrity,drama comedy,exzentrik independent film reporter exwife spectacle,kenneth branagh judy davis joe mantegna leonardo dicaprio charlize theron,6.0,111,exzentrik independent film reporter exwife spectacle kenneth branagh judy davis joe mantegna leonardo dicaprio charlize theron drama comedy
10362,Two Lovers,drama romance,love of ones life neighbor,joaquin phoenix gwyneth paltrow isabella rossellini vinessa shaw moni moshonov,6.6,154,love of ones life neighbor joaquin phoenix gwyneth paltrow isabella rossellini vinessa shaw moni moshonov drama romance
1255,The Host,horror drama science fiction,river mobile phone bravery archer daughter,song kangho park haeil bae doona ko ahsung byun heebong,6.7,537,river mobile phone bravery archer daughter song kangho park haeil bae doona ko ahsung byun heebong horror drama science fiction
10212,Ravenous,comedy horror thriller western,winter cliff cooking cave nudity,guy pearce robert carlyle david arquette jeremy davies neal mcdonough,6.9,141,winter cliff cooking cave nudity guy pearce robert carlyle david arquette jeremy davies neal mcdonough comedy horror thriller western
