id,title,genres,keywords,cast,vote_average,vote_count,soup
10771,The Tuxedo,thriller action comedy science fiction,bomb intelligence chauffeur wound secret agent,jackie chan jennifer love hewitt jason isaacs debi mazar ritchie coster,5.3,483,bomb intelligence chauffeur wound secret agent jackie chan jennifer love hewitt jason isaacs debi mazar ritchie coster thriller action comedy science fiction
3512,Under Siege 2: Dark Territory,action thriller,terrorist pentagon satellite navy seal train,steven seagal eric bogosian everett mcgill katherine heigl morris chestnut,5.6,210,terrorist pentagon satellite navy seal train steven seagal eric bogosian everett mcgill katherine heigl morris chestnut action thriller
137094,Jack Ryan: Shadow Recruit,action drama thriller,london england corruption cia terrorist sniper,chris pine keira knightley kevin costner kenneth branagh lenn kudrjawizki,5.9,1173,london england corruption cia terrorist sniper chris pine keira knightley kevin costner kenneth branagh lenn kudrjawizki action drama thriller
274479,Joy,drama comedy,factory inventor strong woman biography based on true story,jennifer lawrence bradley cooper robert de niro dascha polanco edgar ramuedrez,6.4,1581,factory inventor strong woman biography based on true story jennifer lawrence bradley cooper robert de niro dascha polanco edgar ramuedrez drama comedy
267860,London Has Fallen,action crime thriller,london england terrorist terrorist attack,gerard butler aaron eckhart morgan freeman angela bassett melissa leo,5.8,1621,london england terrorist terrorist attack gerard butler aaron eckhart morgan freeman angela bassett melissa leo action crime thriller
8078,Alien: Resurrection,science fiction horror action,android mercenary dystopia sequel alien,sigourney weaver winona ryder brad dourif ron perlman michael wincott,5.9,1365,android mercenary dystopia sequel alien sigourney weaver winona ryder brad dourif ron perlman michael wincott science fiction horror action
7485,Shooter,action drama mystery thriller crime,corruption sniper senator conspiracy of murder childlessness,mark wahlberg michael peufa danny glover kate mara elias koteas,6.9,1462,corruption sniper senator conspiracy of murder childlessness mark wahlberg michael peufa danny glover kate mara elias koteas action drama mystery thriller crime
170687,The Boxtrolls,animation comedy family fantasy,based on novel stop motion father daughter relationship unlikely friendship duringcreditsstinger,ben kingsley isaac hempsteadwright elle fanning dee bradley baker toni collette,6.6,668,based on novel stop motion father daughter relationship unlikely friendship duringcreditsstinger ben kingsley isaac hempsteadwright elle fanning dee bradley baker toni collette animation comedy family fantasy
6435,Practical Magic,drama fantasy comedy,witch magic sorcery love curse,sandra bullock nicole kidman evan rachel wood goran visnjic stockard channing,6.3,338,witch magic sorcery love curse sandra bullock nicole kidman evan rachel wood goran visnjic stockard channing drama fantasy comedy
137106,The Lego Movie,adventure animation comedy family fantasy,father son relationship creativity friendship part live action toys,chris pratt will ferrell elizabeth banks will arnett nick offerman,7.5,3070,father son relationship creativity friendship part live action toys chris pratt will ferrell elizabeth banks will arnett nick offerman adventure animation comedy family fantasy
10040,Miss Congeniality 2: Armed and Fabulous,action comedy,ransom press conference ship miss america fbi agent,sandra bullock regina king enrique murciano william shatner eileen brennan,5.3,425,ransom press conference ship miss america fbi agent sandra bullock regina king enrique murciano william shatner eileen brennan action comedy
6278,Reign of Fire,adventure action fantasy,dragon evolution fire chief animated map theatre audience,christian bale matthew mcconaughey izabella scorupco gerard butler alexander siddig,6.0,669,dragon evolution fire chief animated map theatre audience christian bale matthew mcconaughey izabella scorupco gerard butler alexander siddig adventure action fantasy
82682,Gangster Squad,crime drama action thriller,los angeles gangster,josh brolin ryan gosling nick nolte emma stone sean penn,6.2,1778,los angeles gangster josh brolin ryan gosling nick nolte emma stone sean penn crime drama action thriller
17610,Year One,comedy adventure,temple slavery stone age circumcision hebrews,jack black michael cera olivia wilde oliver platt david cross,4.6,524,temple slavery stone age circumcision hebrews jack black michael cera olivia wilde oliver platt david cross comedy adventure
22954,Invictus,drama history,stadium south africa apartheid nelson mandela sport,morgan freeman matt damon tony kgoroge patrick mofokeng matt stern,7.0,1125,stadium south africa apartheid nelson mandela sport morgan freeman matt damon tony kgoroge patrick mofokeng matt stern drama history
16995,State of Play,action,corruption assassination detective journalist assassin,russell crowe ben affleck rachel mcadams robin wright jason bateman,6.7,484,corruption assassination detective journalist assassin russell crowe ben affleck rachel mcadams robin wright jason bateman action
16558,Duplicity,romance comedy crime,spy,clive owen julia roberts paul giamatti tom wilkinson lisa roberts gillan,5.7,201,spy clive owen julia roberts paul giamatti tom wilkinson lisa roberts gillan romance comedy crime
5820,The Sentinel,action thriller crime,usa president agent,michael douglas kiefer sutherland eva longoria martin donovan kim basinger,5.8,225,usa president agent michael douglas kiefer sutherland eva longoria martin donovan kim basinger action thriller crime
16866,Planet 51,science fiction animation family comedy adventure,flying saucer alien lifeform spaceship alien alien planet,dwayne johnson seann william scott jessica biel justin long gary oldman,5.6,556,flying saucer alien lifeform spaceship alien alien planet dwayne johnson seann william scott jessica biel justin long gary oldman science fiction animation family comedy adventure
201,Star Trek: Nemesis,science fiction action adventure thriller,clone assassination ambush federation starfleet,patrick stewart jonathan frakes brent spiner levar burton michael dorn,6.1,479,clone assassination ambush federation starfleet patrick stewart jonathan frakes brent spiner levar burton michael dorn science fiction action adventure thriller
11775,Intolerable Cruelty,crime comedy romance,california assassin infidelity fetish hitman,george clooney catherine zetajones edward herrmann geoffrey rush richard jenkins,5.8,391,california assassin infidelity fetish hitman george clooney catherine zetajones edward herrmann geoffrey rush richard jenkins crime comedy romance
87825,Trouble with the Curve,drama romance,women baseball pitcher home run aging,clint eastwood amy adams justin timberlake john goodman matthew lillard,6.6,366,women baseball pitcher home run aging clint eastwood amy adams justin timberlake john goodman matthew lillard drama romance
12201,Edge of Darkness,crime drama mystery thriller,murder violence death of daughter homicide detective,mel gibson ray winstone danny huston shawn roberts denis ohare,6.2,487,murder violence death of daughter homicide detective mel gibson ray winstone danny huston shawn roberts denis ohare crime drama mystery thriller
11015,The Relic,horror mystery thriller,chicago based on novel monster museum pile of dead bodies,penelope ann miller tom sizemore linda hunt james whitmore clayton rohner,5.8,130,chicago based on novel monster museum pile of dead bodies penelope ann miller tom sizemore linda hunt james whitmore clayton rohner horror mystery thriller
9932,Analyze That,comedy crime,prison gold therapist gangster,robert de niro billy crystal lisa kudrow joe viterelli cathy moriarty,5.7,380,prison gold therapist gangster robert de niro billy crystal lisa kudrow joe viterelli cathy moriarty comedy crime
13389,Righteous Kill,action crime drama thriller,revenge murder plot twist dirty cop,robert de niro carla gugino cent al pacino donnie wahlberg,5.9,375,revenge murder plot twist dirty cop robert de niro carla gugino cent al pacino donnie wahlberg action crime drama thriller
8838,Mercury Rising,action crime drama thriller,assassin loss of family autism fbi bangkok,bruce willis alec baldwin miko hughes chi mcbride kim dickens,6.0,368,assassin loss of family autism fbi bangkok bruce willis alec baldwin miko hughes chi mcbride kim dickens action crime drama thriller
17332,The Soloist,drama,newspaper cello musical violin los angeles,robert downey jr jamie foxx catherine keener nelsan ellis michael bunin,6.6,234,newspaper cello musical violin los angeles robert downey jr jamie foxx catherine keener nelsan ellis michael bunin drama
4958,The Legend of Bagger Vance,fantasy drama,competition world war i great depression caddy savannah,matt damon bruce mcgill charlize theron will smith joel gretsch,6.3,251,competition world war i great depression caddy savannah matt damon bruce mcgill charlize theron will smith joel gretsch fantasy drama
786,Almost Famous,drama music,hotel room san diego drug addiction stewardess overdose,kate hudson billy crudup frances mcdormand jason lee patrick fugit,7.4,797,hotel room san diego drug addiction stewardess overdose kate hudson billy crudup frances mcdormand jason lee patrick fugit drama music
9513,Garfield: A Tail of Two Kitties,animation comedy family,london england cat mistake in person luxury wretch,bill murray jennifer love hewitt billy connolly ian abercrombie breckin meyer,5.1,464,london england cat mistake in person luxury wretch bill murray jennifer love hewitt billy connolly ian abercrombie breckin meyer animation comedy family
11679,xXx: State of the Union,action adventure crime drama mystery,washington dc helicopter usa president general coup detat,ice cube samuel l jackson willem dafoe scott speedman peter strauss,4.7,549,washington dc helicopter usa president general coup detat ice cube samuel l jackson willem dafoe scott speedman peter strauss action adventure crime drama mystery
38321,Priest,action science fiction fantasy thriller horror,vampire crucifixion postapocalyptic dystopia vampire hunter,paul bettany karl urban cam gigandet maggie q lily collins,5.4,692,vampire crucifixion postapocalyptic dystopia vampire hunter paul bettany karl urban cam gigandet maggie q lily collins action science fiction fantasy thriller horror
14411,Sinbad: Legend of the Seven Seas,family animation adventure,prince water monster,brad pitt catherine zetajones michelle pfeiffer joseph fiennes dennis haysbert,6.6,372,prince water monster brad pitt catherine zetajones michelle pfeiffer joseph fiennes dennis haysbert family animation adventure
8413,Event Horizon,horror science fiction mystery,space marine nudity nightmare hallucination cryogenics,laurence fishburne sam neill kathleen quinlan joely richardson richard t jones,6.5,742,space marine nudity nightmare hallucination cryogenics laurence fishburne sam neill kathleen quinlan joely richardson richard t jones horror science fiction mystery
10052,Dragonfly,drama,pregnancy and birth voice dragonfly car crash jungle,kevin costner joe morton ron rifkin susanna thompson kathy bates,6.1,204,pregnancy and birth voice dragonfly car crash jungle kevin costner joe morton ron rifkin susanna thompson kathy bates drama
9676,The Black Dahlia,drama,pornography observer los angeles murder hunt,josh hartnett scarlett johansson aaron eckhart hilary swank mia kirshner,5.7,287,pornography observer los angeles murder hunt josh hartnett scarlett johansson aaron eckhart hilary swank mia kirshner drama
9664,Flyboys,action adventure drama history romance,world war i biplane,james franco david ellison jean reno philip winchester abdul salis,6.3,271,world war i biplane james franco david ellison jean reno philip winchester abdul salis action adventure drama history romance
2100,The Last Castle,action drama thriller,prison general,robert redford james gandolfini mark ruffalo steve burton delroy lindo,7.0,285,prison general robert redford james gandolfini mark ruffalo steve burton delroy lindo action drama thriller
10384,Supernova,horror science fiction thriller,black people starships future star supernova,james spader angela bassett robert forster lou diamond phillips peter facinelli,4.9,109,black people starships future star supernova james spader angela bassett robert forster lou diamond phillips peter facinelli horror science fiction thriller
137321,Winter's Tale,drama fantasy mystery romance,based on novel,colin farrell jessica brown findlay russell crowe william hurt jennifer connelly,6.0,487,based on novel colin farrell jessica brown findlay russell crowe william hurt jennifer connelly drama fantasy mystery romance
123553,The Mortal Instruments: City of Bones,action adventure drama mystery romance,angel vampire werewolf warlock downworlder,lily collins jamie campbell bower kevin zegers jemima west robert sheehan,6.2,1602,angel vampire werewolf warlock downworlder lily collins jamie campbell bower kevin zegers jemima west robert sheehan action adventure drama mystery romance
11260,Meet Dave,comedy science fiction adventure family,new york captain starships new love earth,eddie murphy elizabeth banks gabrielle union scott caan ed helms,5.0,371,new york captain starships new love earth eddie murphy elizabeth banks gabrielle union scott caan ed helms comedy science fiction adventure family
9009,Dark Water,drama horror thriller,based on novel water remake teacher divorce,jennifer connelly john c reilly tim roth dougray scott pete postlethwaite,5.3,274,based on novel water remake teacher divorce jennifer connelly john c reilly tim roth dougray scott pete postlethwaite drama horror thriller
11374,Edtv,comedy,tv show tv station simulated reality reality tv tv star,matthew mcconaughey woody harrelson sally kirkland jenna elfman martin landau,5.7,166,tv show tv station simulated reality reality tv tv star matthew mcconaughey woody harrelson sally kirkland jenna elfman martin landau comedy
2309,Inkheart,adventure family fantasy,book fairy tale eavesdropping adventure writers block,brendan fraser sienna guillory andy serkis eliza bennett paul bettany,6.0,592,book fairy tale eavesdropping adventure writers block brendan fraser sienna guillory andy serkis eliza bennett paul bettany adventure family fantasy
8285,The Spirit,action comedy thriller crime science fiction,secret identity robber mask frog based on comic strip,gabriel macht scarlett johansson samuel l jackson eva mendes paz vega,4.7,320,secret identity robber mask frog based on comic strip gabriel macht scarlett johansson samuel l jackson eva mendes paz vega action comedy thriller crime science fiction
210860,Mortdecai,comedy adventure,based on novel painting debt art dealer stolen painting,johnny depp gwyneth paltrow ewan mcgregor paul bettany olivia munn,5.4,1055,based on novel painting debt art dealer stolen painting johnny depp gwyneth paltrow ewan mcgregor paul bettany olivia munn comedy adventure
2312,In the Name of the King: A Dungeon Siege Tale,adventure fantasy action drama,fictional place monster loss of family new love hero,jason statham john rhysdavies ray liotta leelee sobieski burt reynolds,4.1,224,fictional place monster loss of family new love hero jason statham john rhysdavies ray liotta leelee sobieski burt reynolds adventure fantasy action drama
9839,Beyond Borders,drama romance adventure war,london england cia landmine love of ones life cambodia,angelina jolie clive owen teri polo linus roache noah emmerich,6.7,110,london england cia landmine love of ones life cambodia angelina jolie clive owen teri polo linus roache noah emmerich drama romance adventure war
293660,Deadpool,action adventure comedy,anti hero mercenary marvel comic superhero based on comic book,ryan reynolds morena baccarin ed skrein tj miller gina carano,7.4,10995,anti hero mercenary marvel comic superhero based on comic book ryan reynolds morena baccarin ed skrein tj miller gina carano action adventure comedy
9713,Holy Man,drama comedy,salesclerk television tv ratings guru television producer,eddie murphy jeff goldblum kelly preston robert loggia jon cryer,4.9,111,salesclerk television tv ratings guru television producer eddie murphy jeff goldblum kelly preston robert loggia jon cryer drama comedy
190859,American Sniper,war action,sniper biography iraq navy seal us soldier,bradley cooper sienna miller kyle gallner cole konis ben reed,7.4,4469,sniper biography iraq navy seal us soldier bradley cooper sienna miller kyle gallner cole konis ben reed war action
257445,Goosebumps,adventure horror comedy,based on novel magic fantasy werewolf family,jack black dylan minnette odeya rush amy ryan jillian bell,6.2,995,based on novel magic fantasy werewolf family jack black dylan minnette odeya rush amy ryan jillian bell adventure horror comedy
9007,Just Like Heaven,comedy fantasy romance,coma based on novel workaholic flirt architect,reese witherspoon mark ruffalo donal logue dina spybeywaters ben shenkman,6.5,579,coma based on novel workaholic flirt architect reese witherspoon mark ruffalo donal logue dina spybeywaters ben shenkman comedy fantasy romance
889,The Flintstones in Viva Rock Vegas,science fiction comedy family romance,waitress marriage proposal flirt stone age best friend,mark addy stephen baldwin kristen johnston jane krakowski joan collins,4.4,134,waitress marriage proposal flirt stone age best friend mark addy stephen baldwin kristen johnston jane krakowski joan collins science fiction comedy family romance
1370,Rambo III,action adventure thriller war,competition submachine gun soviet union liberation russian,sylvester stallone richard crenna kurtwood smith spiros focues sasson gabai,5.7,690,competition submachine gun soviet union liberation russian sylvester stallone richard crenna kurtwood smith spiros focues sasson gabai action adventure thriller war
4942,Leatherheads,comedy romance drama,american football sports team stadium hero success,george clooney renuee zellweger john krasinski wayne duvall stephen root,5.7,130,american football sports team stadium hero success george clooney renuee zellweger john krasinski wayne duvall stephen root comedy romance drama
347969,The Ridiculous 6,comedy western,wild west,adam sandler taylor lautner steve buscemi terry crews danny trejo,4.9,388,wild west adam sandler taylor lautner steve buscemi terry crews danny trejo comedy western
24438,Did You Hear About the Morgans?,comedy,witness protection comedy duringcreditsstinger,hugh grant sarah jessica parker mary steenburgen sam elliott natalia klimas,5.1,276,witness protection comedy duringcreditsstinger hugh grant sarah jessica parker mary steenburgen sam elliott natalia klimas comedy
116741,The Internship,comedy,job interview loss of job intern reference to google new job,owen wilson vince vaughn rose byrne max minghella aasif mandvi,6.1,1658,job interview loss of job intern reference to google new job owen wilson vince vaughn rose byrne max minghella aasif mandvi comedy
35791,Resident Evil: Afterlife,action adventure horror science fiction,postapocalyptic dystopia undead biohazard evil corporation,milla jovovich wentworth miller ali larter kim coates kacey clarke,5.8,1363,postapocalyptic dystopia undead biohazard evil corporation milla jovovich wentworth miller ali larter kim coates kacey clarke action adventure horror science fiction
72431,Red Tails,drama action adventure history war,world war ii fighter pilot fighter plane,bryan cranston david oyelowo cuba gooding jr daniela ruah terrence howard,5.9,178,world war ii fighter pilot fighter plane bryan cranston david oyelowo cuba gooding jr daniela ruah terrence howard drama action adventure history war
1813,The Devil's Advocate,drama horror mystery thriller,child abuse southern usa obsession subway nudity,keanu reeves al pacino charlize theron jeffrey jones judith ivey,7.2,1374,child abuse southern usa obsession subway nudity keanu reeves al pacino charlize theron jeffrey jones judith ivey drama horror mystery thriller
87428,That's My Boy,comedy,deadbeat dad cheating fiancuee teacher student sex brother sister incest,adam sandler susan sarandon eva amurri martino leighton meester andy samberg,5.5,453,deadbeat dad cheating fiancuee teacher student sex brother sister incest adam sandler susan sarandon eva amurri martino leighton meester andy samberg comedy
8840,DragonHeart,fantasy,magic kingdom despot immortality village,dennis quaid david thewlis pete postlethwaite dina meyer julie christie,6.4,535,magic kingdom despot immortality village dennis quaid david thewlis pete postlethwaite dina meyer julie christie fantasy
10589,After the Sunset,action comedy crime drama,bahamas master thief crook couple,pierce brosnan salma hayek woody harrelson troy garity russell hornsby,6.0,226,bahamas master thief crook couple pierce brosnan salma hayek woody harrelson troy garity russell hornsby action comedy crime drama
71676,Ghost Rider: Spirit of Vengeance,action fantasy thriller,monk eastern europe skeleton biker marvel comic,nicolas cage ciaruen hinds violante placido fergus riordan johnny whitworth,4.7,1135,monk eastern europe skeleton biker marvel comic nicolas cage ciaruen hinds violante placido fergus riordan johnny whitworth action fantasy thriller
1722,Captain Corelli's Mandolin,drama history romance,officer greek island mandolin italian soldier resistance fighter,nicolas cage penuelope cruz john hurt christian bale irene papas,5.5,145,officer greek island mandolin italian soldier resistance fighter nicolas cage penuelope cruz john hurt christian bale irene papas drama history romance
10022,The Pacifier,action comedy drama family thriller,bodybuilder children body guard scientist family,vin diesel lauren graham faith ford chris potter brittany snow,5.8,842,bodybuilder children body guard scientist family vin diesel lauren graham faith ford chris potter brittany snow action comedy drama family thriller
11358,Walking Tall,adventure drama action thriller,casino sheriff home violence special forces,dwayne johnson johnny knoxville neal mcdonough kristen wilson cobie smulders,6.0,381,casino sheriff home violence special forces dwayne johnson johnny knoxville neal mcdonough kristen wilson cobie smulders adventure drama action thriller
13,Forrest Gump,comedy drama romance,vietnam veteran hippie mentally disabled running based on novel,tom hanks robin wright gary sinise mykelti williamson sally field,8.2,7927,vietnam veteran hippie mentally disabled running based on novel tom hanks robin wright gary sinise mykelti williamson sally field comedy drama romance
6477,Alvin and the Chipmunks,comedy music family fantasy animation,pop pop star record producer surprise approach,jason lee david cross cameron richardson jane lynch justin long,5.5,1177,pop pop star record producer surprise approach jason lee david cross cameron richardson jane lynch justin long comedy music family fantasy animation
1597,Meet the Parents,comedy romance,cia airport cat jew orderly,ben stiller robert de niro teri polo blythe danner owen wilson,6.6,1698,cia airport cat jew orderly ben stiller robert de niro teri polo blythe danner owen wilson comedy romance
10530,Pocahontas,adventure animation drama family,culture clash settler forbidden love colony musical,irene bedard mel gibson david ogden stiers john kassir russell means,6.7,1457,culture clash settler forbidden love colony musical irene bedard mel gibson david ogden stiers john kassir russell means adventure animation drama family
1924,Superman,action adventure fantasy science fiction,saving the world journalist dc comics crime fighter nuclear missile,christopher reeve marlon brando margot kidder gene hackman ned beatty,6.9,1022,saving the world journalist dc comics crime fighter nuclear missile christopher reeve marlon brando margot kidder gene hackman ned beatty action adventure fantasy science fiction
9327,The Nutty Professor,fantasy comedy romance science fiction,overweight overweight man duringcreditsstinger,eddie murphy jada pinkett smith james coburn larry miller dave chappelle,5.4,702,overweight overweight man duringcreditsstinger eddie murphy jada pinkett smith james coburn larry miller dave chappelle fantasy comedy romance science fiction
8488,Hitch,comedy drama romance,speed date romantic comedy dating,will smith eva mendes kevin james amber valletta julie ann emery,6.4,1665,speed date romantic comedy dating will smith eva mendes kevin james amber valletta julie ann emery comedy drama romance
10603,George of the Jungle,adventure comedy family romance,africa san francisco gorilla lion feral child,brendan fraser leslie mann thomas haden church john cleese richard roundtree,5.4,496,africa san francisco gorilla lion feral child brendan fraser leslie mann thomas haden church john cleese richard roundtree adventure comedy family romance
8273,American Wedding,comedy romance,handcuffs sister sister relationship spanner blow job stag night,jason biggs alyson hannigan seann william scott eddie kaye thomas thomas ian nicholas,6.0,1129,handcuffs sister sister relationship spanner blow job stag night jason biggs alyson hannigan seann william scott eddie kaye thomas thomas ian nicholas comedy romance
109424,Captain Phillips,action drama thriller,ship hijacking somalia fisherman blood,tom hanks catherine keener max martini chris mulkey yul vazquez,7.6,2454,ship hijacking somalia fisherman blood tom hanks catherine keener max martini chris mulkey yul vazquez action drama thriller
35056,Date Night,comedy,date corruption taxi expensive restaurant wife husband relationship,tina fey steve carell mark wahlberg taraji p henson jimmi simpson,5.9,1122,date corruption taxi expensive restaurant wife husband relationship tina fey steve carell mark wahlberg taraji p henson jimmi simpson comedy
